{
  "schema_version": 1,
  "type": "anomaly_event",
  "produced_at": "2026-01-09T12:00:15.000Z",
  "source": {
    "provider": "skysentinel-processing"
  },
  "payload": {
    "icao24": "a0b1c2",
    "callsign": "UAL123",
    "anomaly_type": "EMERGENCY_DESCENT",
    "severity": "HIGH",
    "detected_at": "2026-01-09T12:00:15.000Z",
    "position": {
      "lat": 40.65,
      "lon": -73.77
    },
    "details": {
      "descent_rate_mps": -20.3,
      "descent_rate_fpm": -3996,
      "confirmed_samples": 3
    }
  }
}
